"Looks like Magento went into infinit loop... Product ID - %1. Image - %2","Sieht so aus, als ob Magento in die Infinit-Schleife ging... Produkt-ID - %1. Bild - %2"
"Misc. string in path of resized image","Sonstige Zeichenfolge im Pfad des geänderten Bildes"
"Use clear parameters for product images","Verwenden klarer Parameter für Produktbilder"
"Image Name",Bildname
"Product image template",Produktbildvorlage
"Magento codes all resize parameters of image into hash string. Adds this hash to resized image path. With option below you can enable clear parameters presentation. Instead of ""ea013e3e574bd4924b1531f962e2c015"" you will get ""240x300"".","Magento kodiert alle Größenänderungsparameter des Bildes in Hashzeichenfolge. Fügt diesen Hash dem Pfad mit geänderter Größe hinzu. Mit Option unten können Sie klare Parameter Darstellung aktivieren. Anstelle von ""ea013e3e574bd4924b1531f962e2c015"" erhalten Sie ""240x300""."
"Magento adds file extension at the end. Template supports directives:<br /><b>{{sku}}</b> - product SKU;<br /><b>{{name}}</b> - product name;<br /><b>{{attribute code=""attr_code""}}</b> - returns value of product attribute with code `attr_code`.<br />Check module docs for more details about template.","Magento adds file extension at the end. Template supports directives:<br /><b>{{sku}}</b> - product SKU;<br /><b>{{name}}</b> - product name;<br /><b>{{attribute code=""attr_code""}}</b> - returns value of product attribute with code `attr_code`.<br />Check module docs for more details about template."
"None of settings affects original images. Everything can be turned off easy and reverted to default Magento behaviour.","Keine der Einstellungen wirkt sich auf Originalbilder aus. Alles kann einfach ausgeschaltet und auf das standardmäßige Magento-Verhalten zurückgesetzt werden."
