"Looks like Magento went into infinit loop... Product ID - %1. Image - %2","Het lijkt erop dat Magento ging in infinit lus ... Product-ID - %1. Afbeelding - %2"
"Misc. string in path of resized image","Misc. tekenreeks in pad van verkleinde afbeelding"
"Use clear parameters for product images","Duidelijke parameters gebruiken voor productafbeeldingen"
"Image Name",Afbeeldingsnaam
"Product image template","Sjabloon voor productafbeelding"
"Magento codes all resize parameters of image into hash string. Adds this hash to resized image path. With option below you can enable clear parameters presentation. Instead of ""ea013e3e574bd4924b1531f962e2c015"" you will get ""240x300"".","Magento codeert alle grootteparameters van de afbeelding in hashtekenreeks. Hiermee voegt u deze hash toe aan het formaat van het afbeeldingspad. Met onderstaande optie u duidelijke parameters presentatie inschakelen. In plaats van ""ea013e3e574bd4924b1531f962e2c015"" krijg je ""240x300""."
"Magento adds file extension at the end. Template supports directives:<br /><b>{{sku}}</b> - product SKU;<br /><b>{{name}}</b> - product name;<br /><b>{{attribute code=""attr_code""}}</b> - returns value of product attribute with code `attr_code`.<br />Check module docs for more details about template.","Magento voegt bestandsextensie aan het einde. Sjabloon ondersteunt richtlijnen:<br /><b>{{sku}}</b> - product SKU;<br /><b>{{name}}</b> - productnaam;<br /><b>{{attribuutcode=""attr_code""}}</b> - retourneert de waarde van het productkenmerk met code 'attr_code'.<br />Controleer moduledocumenten voor meer details over sjabloon."
"None of settings affects original images. Everything can be turned off easy and reverted to default Magento behaviour.","Geen van de instellingen heeft invloed op originele afbeeldingen. Alles kan eenvoudig worden uitgeschakeld en worden teruggezet naar standaard Magento-gedrag."
