"Looks like Magento went into infinit loop... Product ID - %1. Image - %2","看起来马根托进入了无限循环...产品 ID - %1。图片 - %2"
"Misc. string in path of resized image",调整图像路径中的杂项字符串
"Use clear parameters for product images",对产品图像使用清晰的参数
"Image Name",图像名称
"Product image template",产品图像模板
"Magento codes all resize parameters of image into hash string. Adds this hash to resized image path. With option below you can enable clear parameters presentation. Instead of ""ea013e3e574bd4924b1531f962e2c015"" you will get ""240x300"".","Magento 将所有图像参数调整到哈希字符串中。添加此哈希以调整图像路径的大小。通过下面的选项，您可以启用清晰的参数表示。而不是""ea013e3e574bd4924b1531f962e2c015""你会得到""240x300""。"
"Magento adds file extension at the end. Template supports directives:<br /><b>{{sku}}</b> - product SKU;<br /><b>{{name}}</b> - product name;<br /><b>{{attribute code=""attr_code""}}</b> - returns value of product attribute with code `attr_code`.<br />Check module docs for more details about template.","Magento adds file extension at the end. Template supports directives:<br /><b>{{sku}}</b> - product SKU;<br /><b>{{name}}</b> - product name;<br /><b>{{attribute code=""attr_code""}}</b> - returns value of product attribute with code `attr_code`.<br />Check module docs for more details about template."
"None of settings affects original images. Everything can be turned off easy and reverted to default Magento behaviour.",任何设置都不会影响原始图像。一切都可以轻松关闭，并恢复到默认的马根托行为。
